{
  "$schema": "https://json-schema.org/draft/2020-12/schema",
  "$id": "https://pptx.dev/schema/opf-narrative/v1",
  "title": "OPF Narrative Template",
  "description": "Schema for narrative template files in the pptx.dev library. Each template describes a named story arc (e.g. 'problem-solution', 'scqa') as an ordered list of beats. Templates are referenced from OPF documents via meta.narrative.template.",
  "type": "object",
  "required": ["$schema", "id", "name", "beats"],
  "properties": {
    "$schema": {
      "type": "string",
      "const": "https://pptx.dev/schema/opf-narrative/v1"
    },
    "id": {
      "type": "string",
      "pattern": "^[a-z][a-z0-9-]*$",
      "description": "Stable slug used by OPF documents to reference this template, e.g. 'problem-solution'. Lowercase kebab-case."
    },
    "name": {
      "type": "string",
      "description": "Human-readable template name, e.g. 'Problem → Solution'."
    },
    "summary": {
      "type": "string",
      "description": "One-sentence description of when and why to use this narrative."
    },
    "audienceFit": {
      "type": "array",
      "items": { "type": "string" },
      "description": "Audiences this narrative works well for, e.g. ['executives', 'investors', 'customers']."
    },
    "durationRange": {
      "type": "object",
      "description": "Typical talk-length window this narrative suits.",
      "properties": {
        "minMinutes": { "type": "number", "exclusiveMinimum": 0 },
        "maxMinutes": { "type": "number", "exclusiveMinimum": 0 }
      }
    },
    "tags": {
      "type": "array",
      "items": { "type": "string" },
      "description": "Free-form labels for filtering and search, e.g. ['business', 'pitch', 'internal']."
    },
    "beats": {
      "type": "array",
      "minItems": 1,
      "items": { "$ref": "#/$defs/Beat" },
      "description": "Ordered list of beats that make up the narrative arc."
    }
  },
  "$defs": {
    "Beat": {
      "type": "object",
      "description": "A single narrative beat — a labeled segment of the story arc with a specific dramatic purpose. Mirrors the NarrativeBeat definition in opf.schema.json so library entries and inline OPF beats are interchangeable.",
      "required": ["id", "name"],
      "properties": {
        "id": {
          "type": "string",
          "pattern": "^[a-z][a-z0-9-]*$",
          "description": "Stable slug used by Slide.beat to reference this beat. Lowercase kebab-case."
        },
        "name": {
          "type": "string",
          "description": "Human-readable beat name, e.g. 'The Problem'."
        },
        "description": {
          "type": "string",
          "description": "What this beat should accomplish. Used as a prompt for AI-driven generation of slides assigned to this beat."
        },
        "weight": {
          "type": "number",
          "exclusiveMinimum": 0,
          "description": "Relative share of the deck this beat occupies. Engine normalizes weights across all beats; values do not need to sum to 1."
        },
        "slideCount": {
          "type": "integer",
          "minimum": 1,
          "description": "Optional explicit slide count for this beat."
        },
        "layoutHint": {
          "type": "string",
          "description": "Suggested layout for the opening slide of this beat, e.g. 'section-divider', 'title-slide'."
        }
      }
    }
  }
}
