{
  "$schema": "https://pptx.dev/schema/opf-narrative/v1",
  "id": "marketing-strategy",
  "name": "Marketing Strategy",
  "summary": "Comprehensive go-to-market strategy arc structured around the 4Ps. Use for category launches, annual marketing plans, and any deck where the audience needs to see customer, market, competition, and tactics in one coherent picture.",
  "audienceFit": [
    "marketing-leaders",
    "executives",
    "cross-functional-partners"
  ],
  "durationRange": {
    "minMinutes": 30,
    "maxMinutes": 60
  },
  "tags": [
    "go-to-market",
    "marketing",
    "strategy",
    "planning"
  ],
  "beats": [
    {
      "id": "introduction",
      "name": "Introduction",
      "description": "Open by establishing the product or service this strategy is for, and what window of time it covers. One slide that tells the audience exactly which world they're being asked to weigh in on.",
      "instructions": "Establish product/service specifics",
      "slideType": "text",
      "layoutHint": "text-1x-left",
      "options": {
        "multiple": "2x",
        "showLabel": true,
        "showDescription": true
      },
      "placeholders": {
        "tag": false,
        "title": true,
        "subtitle": false,
        "slideImage": false
      }
    },
    {
      "id": "objective",
      "name": "Objective",
      "description": "State the marketing goals in measurable terms: revenue, pipeline, awareness, share. Two or three goals, ranked. Goals without ranking get equal energy and equal mediocrity.",
      "instructions": "Share marketing goals",
      "slideType": "text",
      "layoutHint": "text-1x-left",
      "options": {
        "multiple": "2x",
        "showLabel": true,
        "showDescription": true
      },
      "placeholders": {
        "tag": false,
        "title": true,
        "subtitle": false,
        "slideImage": false
      }
    },
    {
      "id": "customer",
      "name": "Customer",
      "description": "Detail the target audience. Segments, jobs-to-be-done, decision criteria, where they live in the buying cycle. Specificity here is the foundation everything else stands on.",
      "instructions": "Detail target audience",
      "slideType": "text",
      "layoutHint": "text-1x-left",
      "options": {
        "multiple": "2x",
        "showLabel": true,
        "showDescription": true
      },
      "placeholders": {
        "tag": false,
        "title": true,
        "subtitle": false,
        "slideImage": false
      }
    },
    {
      "id": "market",
      "name": "Market",
      "description": "Describe the market landscape: size, growth, segments, behavioral trends. Use external data for credibility and your own research for nuance. Show how the market is changing, not just how big it is.",
      "instructions": "Discuss market landscape",
      "slideType": "text",
      "layoutHint": "text-1x-left",
      "options": {
        "multiple": "2x",
        "showLabel": true,
        "showDescription": true
      },
      "placeholders": {
        "tag": false,
        "title": true,
        "subtitle": false,
        "slideImage": false
      }
    },
    {
      "id": "competition",
      "name": "Competition",
      "description": "Map the competitive set honestly. Direct, indirect, and substitutes. A 2x2 or feature-comparison framework helps; what matters is that the audience trusts your read of the field.",
      "instructions": "Analyze competitive environment",
      "slideType": "text",
      "layoutHint": "text-1x-left",
      "options": {
        "multiple": "2x",
        "showLabel": true,
        "showDescription": true
      },
      "placeholders": {
        "tag": false,
        "title": true,
        "subtitle": false,
        "slideImage": false
      }
    },
    {
      "id": "strategy",
      "name": "Strategy",
      "description": "Articulate the marketing approach in one sentence and a single supporting frame. Positioning, primary motion, where you choose to play and not play. Clarity here is what makes the tactics that follow coherent.",
      "instructions": "Elaborate marketing approach",
      "slideType": "text",
      "layoutHint": "text-1x-left",
      "options": {
        "multiple": "2x",
        "showLabel": true,
        "showDescription": true
      },
      "placeholders": {
        "tag": false,
        "title": true,
        "subtitle": false,
        "slideImage": false
      }
    },
    {
      "id": "product",
      "name": "Product",
      "description": "Highlight the unique value the product brings to the strategy. Lead with the customer outcome; tie it directly back to the customer beat. Avoid feature soup.",
      "instructions": "Highlight unique value",
      "slideType": "text",
      "layoutHint": "text-1x-left",
      "options": {
        "multiple": "2x",
        "showLabel": true,
        "showDescription": true
      },
      "placeholders": {
        "tag": false,
        "title": true,
        "subtitle": false,
        "slideImage": false
      }
    },
    {
      "id": "price",
      "name": "Price",
      "description": "Justify pricing and packaging. Show the logic — cost-plus, value-based, competitor-anchored — and the levers you'll use over the period. Price decisions are strategy decisions.",
      "instructions": "Justify pricing strategy",
      "slideType": "text",
      "layoutHint": "text-1x-left",
      "options": {
        "multiple": "2x",
        "showLabel": true,
        "showDescription": true
      },
      "placeholders": {
        "tag": false,
        "title": true,
        "subtitle": false,
        "slideImage": false
      }
    },
    {
      "id": "place",
      "name": "Place",
      "description": "Describe distribution channels and the role each plays. Direct, partner, marketplace, retail. Channel mix is often where strategies quietly succeed or fail.",
      "instructions": "Discuss distribution channels",
      "slideType": "text",
      "layoutHint": "text-1x-left",
      "options": {
        "multiple": "2x",
        "showLabel": true,
        "showDescription": true
      },
      "placeholders": {
        "tag": false,
        "title": true,
        "subtitle": false,
        "slideImage": false
      }
    },
    {
      "id": "promotion",
      "name": "Promotion",
      "description": "Reveal the campaign and content tactics that bring the strategy to market. Pair each tactic with the audience and metric it serves. Avoid listing channels for their own sake.",
      "instructions": "Reveal promotional tactics",
      "slideType": "text",
      "layoutHint": "text-1x-left",
      "options": {
        "multiple": "2x",
        "showLabel": true,
        "showDescription": true
      },
      "placeholders": {
        "tag": false,
        "title": true,
        "subtitle": false,
        "slideImage": false
      }
    },
    {
      "id": "summary",
      "name": "Summary",
      "description": "Recap the strategy in a single page: customer, position, motion, expected outcome. End with the decision or commitment you need from the audience.",
      "layoutHint": "title-left",
      "instructions": "Recap key points",
      "slideType": "text",
      "options": {
        "multiple": "2x",
        "showLabel": true,
        "showDescription": true
      },
      "placeholders": {
        "tag": false,
        "title": true,
        "subtitle": false,
        "slideImage": false
      }
    }
  ]
}
